"id","name","price","original_price","description","image_url","category","is_featured","is_new","stock_quantity","rating","reviews"
"1","Strawberry Keychain","150","200","Sweet strawberry keychain, small and adorable. A fun everyday accessory!","https://drive.google.com/file/d/185XjgrH4fmbJhxd6hs0M71yAOF78gEhK/view?usp=drive_link","Key Chains and Charms","FALSE","FALSE","30","5","15"
"2","Sunflower Stem","300","400","Brighten up your room with a single crochet sunflower stem. Pick-me-up decor!","https://drive.google.com/file/d/12FbZvLb4JeIWfCt86fCeNd7MglOc1d-Z/view?usp=drive_link","Flowers and Bouquet","FALSE","FALSE","20","4.7","10"
"3","Mushroom Keyring","180","250","A charming magic mushroom keyring — quirky and handcrafted with love.","https://drive.google.com/file/d/1MmA0CP4kTh6qgbMrJosQW7xcjMo0Eehv/view?usp=drive_link","Key Chains and Charms","FALSE","FALSE","22","4.9","11"
"4","Pastel Hair Ties","150","200","Soft crochet scrunchies and hair ties in pastel colors — gentle on your hair.","https://drive.google.com/file/d/1VvDCpBhpPm0VsZOuX6u7_BOW3bWS7kzN/view?usp=drive_link","Hair Accessories","FALSE","TRUE","40","4.6","4"
"5","Mini Blooming Pot","450","550","Tiny detailed flower pot perfect for your desk or windowsill. Zero maintenance!","https://drive.google.com/file/d/1fA0RiF-o_ZDVz-xNSCQxqgeu1gkmE9U1/view?usp=drive_link","Flower Pots","TRUE","TRUE","15","5","7"
"6","Deluxe Gift Hamper","250","300","A curated collection of our finest crochet items — the ultimate gift set.","https://drive.google.com/file/d/15syg0WZWi0IhrQ25RMXSg7Vtu9KNBXiU/view?usp=drive_link","Flowers and Bouquet","TRUE","TRUE","3","5","2"
"7","Elegant Quran Cover","1800","2100","Intricately designed crochet cover for your Quran — a sacred and beautiful gift.","https://drive.google.com/file/d/1vimDlXA21NmjJuga1uxaC80ARYcdSUxw/view?usp=drive_link","Book covers and Sleeves","FALSE","TRUE","5","4.9","6"
"8","Rose Sling Bag","1450","1800","Fashionable sling bag with 3D rose details. A statement piece that turns heads.","https://drive.google.com/file/d/1eSthAB0XEziVFSKDAGXWLeWYT5o5qap6/view?usp=drive_link","Bags and pouches","TRUE","TRUE","6","4.8","12"
"9","Rose Pot","750","900","Classic red rose potted arrangement that never fades. Everlasting beauty.","https://drive.google.com/file/d/1FCa4QoDWPIU3eF8guBQ2Og1z6Sfv8RqX/view?usp=drive_link","Flower Pots","FALSE","FALSE","12","4.7","9"
"10","Sunflower Bouquet Keychain","150","180","Miniature sunflower bouquet as a charming keychain. Tiny artisan delight!","https://drive.google.com/file/d/1zLIS4dXYYb9STT-pu4-3QzkPt6VHh6e6/view?usp=drive_link","Key Chains and Charms","FALSE","TRUE","20","4.8","5"
"11","Sunflower Pot","350","420","Radiant sunflower in a cute crochet pot — a burst of warmth for any room.","https://drive.google.com/file/d/10piefHwbFe9CaEFsQEXF1sjYjyxIfdyX/view?usp=drive_link","Flower Pots","TRUE","FALSE","10","4.9","14"
"12","Tulip & Lavender Bouquet","1700","2040","A perfect harmony of tulips and lavender in one stunning arrangement.","https://drive.google.com/file/d/1bBk5Gxl-nA2IjE6Bw6pyGSfugRnOBC9Z/view?usp=drive_link","Flowers and Bouquet","TRUE","TRUE","8","5","3"
"13","Blue & White Bouquet","1700","2040","Elegant handcrafted bouquet in soft blue and white tones. A timeless gift piece.","https://drive.google.com/file/d/1HFIB-Vtma0wjL89C6c7baAylVijU-jx4/view?usp=drive_link","Flowers and Bouquet","FALSE","TRUE","8","4.9","5"
"14","Mixed Floral Bouquet","950","1200","A cheerful mix of handcrafted crochet flowers in vibrant colors. Perfect centerpiece.","https://drive.google.com/file/d/1aVJuPxn8zurP1TRtzC2Rsbd4YqbujGFT/view?usp=drive_link","Flowers and Bouquet","FALSE","FALSE","12","4.7","7"
"15","Large Floral Bouquet","1700","2040","An impressive large-scale handmade bouquet — a luxurious gift for any occasion.","https://drive.google.com/file/d/18b2QWav4zEQ0yqYjyX6wt_JSGdWw5hEP/view?usp=drive_link","Flowers and Bouquet","TRUE","FALSE","5","5","9"
"16","Mini Roses Bouquet","250","300","Adorable mini rose bouquet — cute, compact, and absolutely heartwarming.","https://drive.google.com/file/d/1LUpqxKbcqFy6HXfFsYZdHxKiA85kYuyu/view?usp=drive_link","Flowers and Bouquet","FALSE","TRUE","15","4.8","4"
"17","Mini Tulip Bouquet","200","240","Delicate handcrafted tulip bouquet in pastel tones. Perfect table decor or gift.","https://drive.google.com/file/d/1OzKYGdAtoquTVj8smlSUSWlDuA2pisVk/view?usp=drive_link","Flowers and Bouquet","FALSE","FALSE","10","4.6","3"
"18","Multi Colour Bouquet","1300","1560","A rainbow of crochet flowers bundled together — vibrant, joyful, and unique.","https://drive.google.com/file/d/11IL7aNDCdS10v0uyYoxSvo2WTpINCTGx/view?usp=drive_link","Flowers and Bouquet","FALSE","TRUE","8","4.7","6"
"19","Rose Bouquet","200","240","Classic handmade crochet rose bouquet — an eternal symbol of love and care.","https://drive.google.com/file/d/1-0m6PZyA7VeYgFJ8Fa6j1Yz4HHdttus2/view?usp=drive_link","Flowers and Bouquet","FALSE","FALSE","14","4.9","11"
"20","Sunflower Bouquet","600","720","Bright and cheerful handmade sunflower bouquet. Brings sunshine to any space.","https://drive.google.com/file/d/1H4o9cvdQXC1iAj0JeKQiyw5UujHHR34h/view?usp=drive_link","Flowers and Bouquet","FALSE","FALSE","10","4.8","8"
"21","Daisy Keychain","120","144","Fresh and dainty daisy flower keychain — a cheerful pop of handmade sunshine.","https://drive.google.com/file/d/1vgUGCvRTVa7uS8CZUpVqIaInLH1HCcou/view?usp=drive_link","Key Chains and Charms","FALSE","TRUE","25","4.7","4"
"22","Flamingo Keychain","350","420","Stand out with this playful handcrafted flamingo keychain. Pink and fabulous!","https://drive.google.com/file/d/1cZgHTQXzHuJz7rTKqfBXbNPmv_oQPhIO/view?usp=drive_link","Key Chains and Charms","FALSE","TRUE","18","4.8","6"
"23","Sunflower Granny Square Keychain","250","300","Handcrafted floral keychain — a dainty accessory made stitch by stitch.","https://drive.google.com/file/d/1nPru_R3FGC9WVMd7XyNoDfX_u7saIib2/view?usp=drive_link","Key Chains and Charms","FALSE","FALSE","30","4.5","3"
"24","Blue Flower Keychain","150","180","Delicate handmade butterfly keychain in soft pastels. Light and lovely.","https://drive.google.com/file/d/1OpJ612XpG242CpGE-uSY9piGaO5W_8vA/view?usp=drive_link","Key Chains and Charms","FALSE","FALSE","25","4.6","5"
"25","Bear Keychain","150","180","Adorable handmade crochet bear keychain. Tiny, huggable, and perfect as a gift.","https://drive.google.com/file/d/14N5rkhCKYfCxuIgOZEgJ-qv-7suWM7zb/view?usp=drive_link","Key Chains and Charms","FALSE","TRUE","20","4.9","7"
"26","Fruit Keychain","150","180","Fun and colourful handcrafted fruit-themed keychain. A cute everyday charm.","https://drive.google.com/file/d/1Bm9BQN7KkeWjKgQY-DN9HnyVqGaea4s5/view?usp=drive_link","Key Chains and Charms","FALSE","FALSE","35","4.5","4"
"27","Star Keychain","150","180","Tiny handcrafted star keychain — a sparkly little companion for your keys.","https://drive.google.com/file/d/1MmA0CP4kTh6qgbMrJosQW7xcjMo0Eehv/view?usp=drive_link","Key Chains and Charms","FALSE","FALSE","40","4.4","3"
"28","Heart Keychain","150","180","A sweet crochet heart keychain — carry a little love with you everywhere.","https://drive.google.com/file/d/1P6IPuikKxRY55llxCz7vJ-Y4Z48fxMSo/view?usp=drive_link","Key Chains and Charms","FALSE","TRUE","35","4.7","8"
"29","Rose Bouquet Keychain","150","180","A tiny rose bouquet on a keychain — handcrafted romance at your fingertips.","https://drive.google.com/file/d/1SeV0Dv1fTQFkOzPzrVzRljqRRNTaJaqL/view?usp=drive_link","Key Chains and Charms","FALSE","TRUE","20","4.8","5"
"30","Rose Keychain","120","144","Classic single rose crochet keychain — elegant, handcrafted, and everlasting.","https://drive.google.com/file/d/1y83fu0uadb-i6bn2OL6S-wU2RIeVKlc6/view?usp=drive_link","Key Chains and Charms","FALSE","FALSE","28","4.6","6"
"31","Shaun the Sheep Keychain","150","180","Everyone's favourite woolly character — now as a handcrafted crochet keychain!","https://drive.google.com/file/d/1Zp9nwuNel3VXMaH7gSEnzyLUREjAhLVw/view?usp=drive_link","Key Chains and Charms","TRUE","TRUE","15","5","10"
"32","Sunflower Keychain","180","230","Bring a ray of sunshine everywhere with this handcrafted sunflower keychain.","https://drive.google.com/file/d/1hyGdlxkCg-tni3wXgDKHLk2Co46HLmmI/view?usp=drive_link","Key Chains and Charms","FALSE","FALSE","22","4.7","4"
"33","Tawaf Tasbih Keychain","150","180","A meaningful handcrafted tasbih keychain — a beautiful reminder of faith.","https://drive.google.com/file/d/12jJX3Yj-oJ3PZ0HKw-aymi0Nqort24c9/view?usp=drive_link","Key Chains and Charms","FALSE","TRUE","12","4.9","8"
"34","Tulip Keychain","150","180","Pretty tulip flower crochet keychain — soft, handmade, and full of charm.","https://drive.google.com/file/d/16suGYUNhPOPUErUi1Dfem2Sg4Q0gBXQO/view?usp=drive_link","Key Chains and Charms","FALSE","FALSE","20","4.6","3"
"35","Chevron Tote Bag","2400","2880","Stylish chevron-patterned crochet tote bag. Spacious, sturdy, and handmade.","https://drive.google.com/file/d/1Ptk9bfB5e4lMqxAW7wx2rwGKLDdIPIIw/view?usp=drive_link","Bags and pouches","TRUE","TRUE","5","4.9","7"
"36","Mini Purse","350","420","Compact and adorable handcrafted crochet mini purse — perfect for essentials.","https://drive.google.com/file/d/1dgBrMyzg47UDWsvbOO-WAqzg7YyhYX48/view?usp=drive_link","Bags and pouches","FALSE","TRUE","10","4.7","6"
"37","Mini Purse with Divider","350","420","Handcrafted crochet mini purse with an inner divider — organised and cute!","https://drive.google.com/file/d/1EjzMEE1oVnbgvTtQru6UnDBtarnjRWaa/view?usp=drive_link","Bags and pouches","FALSE","TRUE","8","4.8","4"
"38","Crochet Pouches Set","250","300","Set of handcrafted crochet pouches — ideal for gifting or everyday organising.","https://drive.google.com/file/d/1CrsyPym7o57DFfrVW-jwXyq547q1Kw9Q/view?usp=drive_link","Bags and pouches","FALSE","FALSE","12","4.6","5"
"39","Tulip Purse","500","600","Adorable tulip-shaped crochet purse — a conversation starter wherever you go.","https://drive.google.com/file/d/1UM7pQH-WA3qKbSYu4WYQd4ZqGIxQeTt5/view?usp=drive_link","Bags and pouches","TRUE","TRUE","6","4.9","9"
"40","iPad Sleeve","850","1020","Protect your iPad in handcrafted style — a padded crochet sleeve made with care.","https://drive.google.com/file/d/1ltWwNFemqfENr2GjZwyRKrJxb09GHiQu/view?usp=drive_link","Book covers and Sleeves","FALSE","TRUE","8","4.8","5"
"41","Hair Cap","1800","2160","Handcrafted crochet hair cap.","https://drive.google.com/file/d/1lG6mzKH3ZEi2Zmajr3102wjsbmvQphZM/view?usp=drive_link","Hair Accessories","FALSE","TRUE","10","5","0"
"42","Dentist Set","2000","2400","Handcrafted crochet dentist set.","https://drive.google.com/file/d/1uCoPx-V2w3RXy376Ivpp0bn1L-earO8s/view?usp=drive_link","Key Chains and Charms","FALSE","TRUE","10","5","0"
"43","Tulip","150","180","Handcrafted single tulip piece.","https://drive.google.com/file/d/1_PcotiUX6J7EiFPrd7Ue0-UUUyXh_7dy/view?usp=drive_link","Flowers and Bouquet","FALSE","TRUE","20","5","0"
"44","Calla Lily","200","240","Elegant handcrafted calla lily.","https://drive.google.com/file/d/135Ibv7A-E_3bbZRVpgAOrPZi8PU8CyYD/view?usp=drive_link","Flowers and Bouquet","FALSE","TRUE","15","5","0"
"45","Lavender","150","180","Beautiful crochet lavender stem.","https://drive.google.com/file/d/17wxujwD6THLSoSKlTAyV-dlnsVi30pUx/view?usp=drive_link","Flowers and Bouquet","TRUE","TRUE","10","5","0"
"46","Ping Pong Flower","400","480","Cute ping pong flower crochet piece.","https://drive.google.com/file/d/1CRcX5UHCFFKk6-aGlisiZbqQKbp0zwts/view?usp=drive_link","Flowers and Bouquet","FALSE","TRUE","10","5","0"
"47","Large Rose","300","360","Large handcrafted crochet rose.","https://drive.google.com/file/d/1Rgg8l8Xt_jo6dCSqZMSr6VLEI1XgXcW3/view?usp=drive_link","Flowers and Bouquet","FALSE","TRUE","12","5","0"
"48","Lily","450","540","Delicate handcrafted lily.","https://drive.google.com/file/d/1oiacxC_r7wsUzptWNTxsAk0jAydglU4s/view?usp=drive_link","Flowers and Bouquet","FALSE","TRUE","8","5","0"
"49","Lily Bouquet","900","1080","Stunning handcrafted lily bouquet.","https://drive.google.com/file/d/1QNi4WwiiqSLFV6SXTxhUcPHJgAOuFkNG/view?usp=drive_link","Flowers and Bouquet","TRUE","TRUE","5","5","0"
"50","Bouquet 4","1800","2160","Beautiful handcrafted multi-flower bouquet.","https://drive.google.com/file/d/18RxzygDgLhajBNUoX4Vf_dHISCLS7zTC/view?usp=drive_link","Flowers and Bouquet","FALSE","TRUE","5","5","0"
"51","Black Purse","1500","1800","Stylish black crochet purse.","https://drive.google.com/file/d/1k7o6wzVQd888Cm3pPGx_v97pohZCeZv9/view?usp=drive_link","Bags and pouches","TRUE","TRUE","8","5","0"
"52","Jersey Keychain","150","180","Cute crochet jersey keychain.","https://drive.google.com/file/d/1JFm-lFHbww3_4TIGuMQ_Vpb7u8LZFerD/view?usp=drive_link","Key Chains and Charms","FALSE","TRUE","20","5","0"
"53","Mixed Pink and Purple Bouquet","1500","1800","Gorgeous handcrafted bouquet.","https://drive.google.com/file/d/1yxL0LwzhtyKzfmiX9IF2t1y-98FJ5fww/view?usp=drive_link","Flowers and Bouquet","FALSE","TRUE","6","5","0"
"54","Purse","500","600","Handcrafted everyday purse.","https://drive.google.com/file/d/1MipEBCi3oENSsO4CO7GuIA98wCUhPNaO/view?usp=drive_link","Bags and pouches","FALSE","TRUE","15","5","0"
"55","Keychain 7","350","420","Unique handcrafted keychain.","https://drive.google.com/file/d/19HMSnbIdbWYSqeyay4JnBTebpp2esjpg/view?usp=drive_link","Key Chains and Charms","FALSE","TRUE","12","5","0"
"56","Bouquet 3","600","720","Handcrafted bouquet 3.","https://drive.google.com/file/d/18nCfjOqwz9gYDcUDxI3y9LULwegF915f/view?usp=drive_link","Flowers and Bouquet","FALSE","TRUE","10","5","0"
"57","Crochet Hat","800","960","Handcrafted crochet hat.","https://drive.google.com/file/d/1oSblfQ-QRADybFaDoS7lIP4WIi6Wwund/view?usp=drive_link","Hair Accessories","FALSE","TRUE","10","5","0"
"58","White Flower Pearl Earrings","250","300","Handcrafted earing 1.","https://drive.google.com/file/d/1gXyamEkCEGlo4URM_noas1l-IbfE-bKY/view?usp=drive_link","Key Chains and Charms","FALSE","TRUE","10","5","0"
"59","Red Heart Pearl Earrings","250","300","Handcrafted earing 2.","https://drive.google.com/file/d/1UbONqscHLiWk7TCrYvbz59ElcGaCzTVc/view?usp=drive_link","Key Chains and Charms","FALSE","TRUE","10","5","0"
"60","Red Rose Hair Tie","150","180","Handcrafted hair-ties 1.","https://drive.google.com/file/d/1NuaQuFljgDyMJLOkDxIJPg-yJ9OUhvJS/view?usp=drive_link","Hair Accessories","FALSE","TRUE","10","5","0"
"61","Hair-ties 10","150","180","Handcrafted hair-ties 10.","https://drive.google.com/file/d/1QsU75PGb16-sNNBrZ2vn6BlQyq1pcsiH/view?usp=drive_link","Hair Accessories","FALSE","TRUE","10","5","0"
"62","Hair-ties 11","150","180","Handcrafted hair-ties 11.","https://drive.google.com/file/d/1OCYTkooeQfFxwQX2zRQeXxD7xpE-WEfq/view?usp=drive_link","Hair Accessories","FALSE","TRUE","10","5","0"
"63","Hair-ties 12","150","180","Handcrafted hair-ties 12.","https://drive.google.com/file/d/1Ijg7py2IvBNPuNvDXwjffXfIPSf8X_5Y/view?usp=drive_link","Hair Accessories","FALSE","TRUE","10","5","0"
"64","Hair-ties 13","150","180","Handcrafted hair-ties 13.","https://drive.google.com/file/d/1bLc9lcGNswXXIBq0AsgcHlZeHS4ZVlBx/view?usp=drive_link","Hair Accessories","FALSE","TRUE","10","5","0"
"65","Purple Flower Hair Tie","150","180","Handcrafted hair-ties 2.","https://drive.google.com/file/d/1A6zpkZcsYmscveGIIFq5VAxWtoeB9XN_/view?usp=drive_link","Hair Accessories","FALSE","TRUE","10","5","0"
"66","Hair-ties 3","150","180","Handcrafted hair-ties 3.","https://drive.google.com/file/d/1SmkgCrbYkMyg8EZ1ZlxWLlzfLanm757y/view?usp=drive_link","Hair Accessories","FALSE","TRUE","10","5","0"
"67","Hair-ties 4","150","180","Handcrafted hair-ties 4.","https://drive.google.com/file/d/1vzjZB4Y_w0wXJNKV8NSOBBhpBRPoyIyj/view?usp=drive_link","Hair Accessories","FALSE","TRUE","10","5","0"
"68","Hair-ties 5","150","180","Handcrafted hair-ties 5.","https://drive.google.com/file/d/1oJzuqb_byJvMWXuPXWyxNgzNc0EJqwt1/view?usp=drive_link","Hair Accessories","FALSE","TRUE","10","5","0"
"69","Hair-ties 6","150","180","Handcrafted hair-ties 6.","https://drive.google.com/file/d/1gLcXuuMqX0p9pfkYjrkMzQtDwcJSBJ8L/view?usp=drive_link","Hair Accessories","FALSE","TRUE","10","5","0"
"70","Hair-ties 7","150","180","Handcrafted hair-ties 7.","https://drive.google.com/file/d/1sC6nqWYqLac8U7HudJMubQPjQ5XWu0bU/view?usp=drive_link","Hair Accessories","FALSE","TRUE","10","5","0"
"71","Hair-ties 8","150","180","Handcrafted hair-ties 8.","https://drive.google.com/file/d/1t2zfUm91BcTon5qRwWoVa3A1AwJNlM0q/view?usp=drive_link","Hair Accessories","FALSE","TRUE","10","5","0"
"72","Hair-ties 9","150","180","Handcrafted hair-ties 9.","https://drive.google.com/file/d/1KAOo-9-LhgTbdk0zeUX-IqCB_aUCjB3y/view?usp=drive_link","Hair Accessories","FALSE","TRUE","10","5","0"
"73","Ice cream keychain","150","180","Handcrafted ice cream keychain.","https://drive.google.com/file/d/1vYLLcewtq5pVmIK6ZX9onLuCu4hW5FEg/view?usp=drive_link","Key Chains and Charms","FALSE","TRUE","10","5","0"
"74","Keychain 10","150","180","Handcrafted keychain 10.","https://drive.google.com/file/d/17QZBLDxpdxyWeyt1Y-IM-F7TeH15_AKJ/view?usp=drive_link","Key Chains and Charms","FALSE","TRUE","10","5","0"
"75","Keychain 11","150","180","Handcrafted keychain 11.","https://drive.google.com/file/d/1tgurNSU8TfKkPfQAAZ4nZZ8cvnruKlCw/view?usp=drive_link","Key Chains and Charms","FALSE","TRUE","10","5","0"
"76","Keychain 12","150","180","Handcrafted keychain 12.","https://drive.google.com/file/d/1_ZAXPYAouZE88zqsWkmEso9kRD-ZjcDR/view?usp=drive_link","Key Chains and Charms","FALSE","TRUE","10","5","0"
"77","Keychain 13","150","180","Handcrafted keychain 13.","https://drive.google.com/file/d/19HQ6yV82X42AexJxUbfMIsYnwC39fpBj/view?usp=drive_link","Key Chains and Charms","FALSE","TRUE","10","5","0"
"78","Keychain 14","150","180","Handcrafted keychain 14.","https://drive.google.com/file/d/1Rj3HA9zgYAGAATOkBapAmF7imJ1hFKom/view?usp=drive_link","Key Chains and Charms","FALSE","TRUE","10","5","0"
"79","Keychain 15","150","180","Handcrafted keychain 15.","https://drive.google.com/file/d/1E3Ec7IF39fYK2qJEaPnA94HlH-oW0DNV/view?usp=drive_link","Key Chains and Charms","FALSE","TRUE","10","5","0"
"80","Keychain 8","150","180","Handcrafted keychain 8.","https://drive.google.com/file/d/1uDzCtncDYMlfZoVPKusZ_TeGNg0jPEnf/view?usp=drive_link","Key Chains and Charms","FALSE","TRUE","10","5","0"
"81","Keychain 9","150","180","Handcrafted keychain 9.","https://drive.google.com/file/d/1iDaTpZLpye8EN8R_SL0RWtVStbk0zENs/view?usp=drive_link","Key Chains and Charms","FALSE","TRUE","10","5","0"
"82","Pink rose","250","300","Handcrafted pink rose.","https://drive.google.com/file/d/1SpS0c23Tx09cac6coRuKP8fcmOWDHLGO/view?usp=drive_link","Flowers and Bouquet","FALSE","TRUE","10","5","0"
"83","Rose pot","450","540","Handcrafted rose pot.","https://drive.google.com/file/d/1FCa4QoDWPIU3eF8guBQ2Og1z6Sfv8RqX/view?usp=drive_link","Flower Pots","FALSE","TRUE","10","5","0"
"84","Rose pot1","450","540","Handcrafted rose pot1.","https://drive.google.com/file/d/1R4Kr6H9WCA-ME4nfHpGlDVYRunxr5ju9/view?usp=drive_link","Flower Pots","FALSE","TRUE","10","5","0"
"85","Small bouquet","600","720","Handcrafted small bouquet.","https://drive.google.com/file/d/12FbZvLb4JeIWfCt86fCeNd7MglOc1d-Z/view?usp=drive_link","Flowers and Bouquet","FALSE","TRUE","10","5","0"
"86","Sunflower pair keychain","150","180","Handcrafted sunflower pair keychain.","https://drive.google.com/file/d/19s5VUFlddsnoQn9C_J0Q_TAhBJloVedT/view?usp=drive_link","Key Chains and Charms","FALSE","TRUE","10","5","0"
"87","Sunflower","250","300","Handcrafted sunflower.","https://drive.google.com/file/d/1LmiYQsMRzVLaxIhX-ObC-sXtR223atGA/view?usp=drive_link","Flowers and Bouquet","FALSE","TRUE","10","5","0"
"88","Yellow bouquet","600","720","Handcrafted yellow bouquet.","https://drive.google.com/file/d/1FFonyX6U97t29j6FmOlBbGkHHXq8FiR6/view?usp=drive_link","Flowers and Bouquet","FALSE","TRUE","10","5","0"
"89","","","","","","","","","","",""